original,translated
Unvorhergesehener Absturz der Datenanalyse-Plattform,Unexpected end of data analysis platform
Customer Support Inquiry,Customer Support Inquiry
Data Analytics for Investment,Data Analytics for Investment
Krankenhaus-Dienstleistung-Problem,Hospital Service Problem
Security,Security
Concerns About Securing Medical Data on 2-in-1 Convertible Laptop with Norton 360,Concerns About Securing Medical Data on 2-in-1 Convertible Laptop with Norton 360
Ratung für Sicherung medizinischer Daten in HubSpot CRM PostgreSQL-Umgebungen,Advice for the protection of medical data in HubSpot CRM PostgreSQL environments
Problem with Integration,Problem with Integration
Assistance Request,Request Help
Support Request,Request Support
Issue with Data Analytics Platform - Insufficient RAM Allocation,Issue with Data Analytics Platform - Insufficient RAM Allocation
Reported Issue with Project Sync Resulting in Data Loss,Reported Issue with Project Sync Resulting in Data Loss
Strategies for Brand Expansion,Strategies for Brand Expansion
Issue with Website Analytics Dashboard,Issue with Website Analytics Dashboard
Urgent: Data Breach Identified in Hospital Network,Urgent: Data Breach Identified in Hospital Network
Request for Assistance with Data Integration,Request for Assistance with Data Integration
Request for Updating Integration Features on Mobile,Request for Updating Integration Features on Mobile
Problem with Data Analytics Software Frequent Crashes,Problem with Data Analytics Software Frequent Crashes
Urgent: Identification of a Data Breach within the Patient Records System,Urgent: Identification of a Data Breach within the Patient Records System
[NO_SUBJECT],[NO_SUBJECT]
Notwendige Technische Unterstützung,Necessary technical support
Urgent: Update Encryption Protocols for JIRA and HubSpot CRM Systems,Urgent: Update Encryption Protocols for JIRA and HubSpot CRM Systems
Guidelines for Securing Medical Data on macOS Systems with Symantec Endpoint Protection,Guidelines for Securing Medical Data on macOS Systems with Symantec Endpoint Protection
Problem with Software Update,Problem with Software Update
Slowness observed in the data analytics platform,Slowness observed in the data analytics platform
Verlust medizinischer Daten gemeldet,Loss of medical data reported
Best Practices for Securing Medical Data with Snagit and KNIME,Best Practices for Securing Medical Data with Snagit and KNIME
Guidance on Optimizing Investment Strategies Using Data Analytics,Guidance on Optimizing Investment Strategies Using Data Analytics
Requirements for Wave Integration with Outlook 2021,Requirements for Wave Integration with Outlook 2021
Issue Regarding Encryption,Issue Regarding Encryption
Problem with Invoice,Problem with Invoice
Anfrage für technischen Support,Application for technical support
Enquiries on Shopware Integrations with Google Cloud and Microsoft Azure,Enquiries on Shopware Integrations with Google Cloud and Microsoft Azure
Enhancing Security for Medical Data Transmission Systems,Enhancing Security for Medical Data Transmission Systems
Expansion of Digital Brand,Expansion of Digital Brand
Support for Data Analytics Platform Crash,Support for Data Analytics Platform Crash
Tech Support Inquiry,Tech Support Inquiry
Problems with SaaS-Tools Integration,Problems with SaaS-Tools Integration
Support for Expanding a Brand,Support for Expanding a Brand
Update Integration Settings for Compatibility,Update Integration Settings for Compatibility
Notwendige technische Unterstützung,Necessary technical support is needed. . . . . . . . . . . . . . . . . . . . . . . . . . . . . . . . . . . . . . . . . . . . . . . . . . . . . . . . . . . . . . . . . . . . . . . . . . . . . . . . . . . . . . . . . . . . . . . . . . . . . . . . . . . . . . . . . . . . . . . . . . . . . . . .
Digital Campaign Synchronization Problem Noted,Digital Campaign Synchronization Problem Noted
Support Needed,Support Needed
Support Request for Data Breach Issue,Support Request for Data Breach Issue
Support Inquiry for Invoice Management,Support Inquiry for Invoice Management
Support for Digital Marketing,Digital Marketing Support
Technische Probleme,Technical problems
Medical Support,Medical Support
Aid for Issues with Website Performance,Aid for Issues with Website Performance
Technical Help,Technical Help
Problem with SQL Server Downtime,Problem with SQL Server Downtime
Strategies for Enhancing Digital Brand Growth,Strategies for Enhancing Digital Brand Growth
Support for QuickBooks,Support for QuickBooks
Support Required,Support Required
Concerns with Data Analytics,Concerns with Data Analytics
Bericht über einen Fehler in der Datenaufbereitungsoberfläche,Report of an error in the data preparation area
Digital Strategies for Growth,Digital Strategies for Growth
Support Inquiry,Support Inquiry
System Requirements,System Requirements
Inquiry on System Requirements for Project Management SaaS,Inquiry on System Requirements for Project Management SaaS
Customer Support,Customer Support
Continuous Issues with Online Product Display,Continuous Issues with Online Product Display
Verbesserung des Projekt-Managements mit Ubuntu 20.04 LTS und Redis 6.2,Improve project management with Ubuntu 20.04 LTS and Redis 6.2
Problem bei der medizinischen Scanner-Bearbeitung,Problem with the medical scanner-processing system. . . . . . . . . . . . . . . . . . . . . . . . . . . . . . . . . . . . . . . . . . . . . . . . . . . . . . . . . . . . . . . . . . . . . . . . . . . . . . . . . . . . . . . . . . . . . . . . . . . . . . . . . . . . . . . . . . . . . . . . . . . .
Problem with Campaign Launch,Problem with Campaign Launch
Problem with Project Management Dashboard,Problem with Project Management Dashboard
Django ElasticSearch HIPAA Compliance Issue,Django ElasticSearch HIPAA Compliance Issue
Support Request: Medical Data Encryption Issue,Support Request: Medical Data Encryption Issue
Security of Medical Data,Security of Medical Data
Assistance Needed,Assistance Needed
Fehler in den Investment-Modellierungs-Ausgaben,Error in investment modelling output
Request for Updating Product Details and Integration Options,Request for Updating Product Details and Integration Options
Benachrichtigung über unbefugten Zugriff auf Server,Cannot initialise Evolution's mail component.
Unterstützung bei digitale Kampagnen,Digital Campaign Support
Assistance Required,Need assistance: . . . . . . . . . . . . . . . . . . . . . . . . . . . . . . . . . . . . . . . . . . . . . . . . . . . . . . . . . . . . . . . . . . . . . . . . . . . . . . . . . . . . . . . . . . . . . . . . . . . . . . . . . . . . . . . . . . . . . . . . . . . . . . . . . . .
Data Breach Incident,Data Breach Incident
Frage zur Anpassbaren Digitalen Strategie-Dienstleistung,Question of the Adaptable Digital Strategy Service (DSP) . . . . . . . . . . . . . . . . . . . . . . . . . . . . . . . . . . . . . . . . . . . . . . . . . . . . . . . . . . . . . . . . . . . . . . . . . . . . . . . . . . . . . . . . . . . . . . . . . . . . . . . . . . . . . . . . . . . . . . . . . .
Investment Data Analytics Platform Crash,Investment Data Analytics Platform Crash
Boost Data Analytics Support,Boost Data Analytics Support
Request for Updated Hardware and Software Compatibility,Request for Updated Hardware and Software Compatibility
Security Measures for Medical Data in Hospital Infrastructure,Security Measures for Medical Data in Hospital Infrastructure
Aktualisierung der Datenbank-Clusterverwaltungskonfiguration,Update database cluster management configuration
Frage zum Einsatz von Elasticsearch in Xero und Microsoft-Produkten,Question about the use of Elasticssearch in Xero and Microsoft-Products in Xero . . . . . . . . . . . . . . . . . . . . . . . . . . . . . . . . . . . . . . . . . . . . . . . . . . . . . . . . . . . . . . . . . . . . . . . . . . . . . . . . . . . . . . . . . . . . . . . . . . . . . . . . . . . . . . . . . . . . . . . . . . . . . . . . . . . .
Support for Security Concern,Support for Security Concern
Verfügbare Integrationsoptionen für QuickBooks Online,Available integration options for QuickBooks Online
Identifying Issues with Campaign Engagement,Identifying Issues with Campaign Engagement
Support for Project Management SaaS Application Issues,Support for Project Management SaaS Application Issues
Update project software dashboard,Update project software dashboard
Securing Medical Data on a WordPress Healthcare Site,Securing Medical Data on a WordPress Healthcare Site
Report on System Outage: Impact on Medical Data Security,Report on System Outage: Impact on Medical Data Security
Jenkins Data Analytics Inquiry,Jenkins Data Analytics Inquiry
Request for DataRobot Integration,Request for DataRobot Integration
Invoicing Discrepancy Inquiry,Invoicing Discrepancy Inquiry
Sicherheit,Security
Integration von ESET NOD32,Integration of ESET NOD32 . . . . . . . . . . . . . . . . . . . . . . . . . . . . . . . . . . . . . . . . . . . . . . . . . . . . . . . . . . . . . . . . . . . . . . . . . . . . . . . . . . . . . . . . . . . . . . . . . . . . . . . . . . . . . . . . . . . . . . . . . . .
Rechnungsfehler,Billing error
Verschiedene Kampagnen-Metriken,Various campaign metrics
Enhancement Strategies,Strategy Extensions
Urgent Assistance Required,Urgent Assistance Necessary
Investment Analytics Tools,Investment Analytics Tools
Product Licenses Missing,Product Licenses Missing
Strategies for Expanding Online Presence with Magento 2.4,Strategies for Expanding Online Presence with Magento 2.4
Enhancing Investment Data Analytics,Enhancing Investment Data Analytics
Inquiry on System Requirements for SaaS Project Management Tool,Inquiry on System Requirements for SaaS Project Management Tool
Project Syncing Issue Encountered,Project Syncing Issue Encountered
Needed: Support for Server Issues,Needed: Support for Server Issues
Issue with Overcharged Subscription Services,Issue with Overcharged Subscription Services
Services in Data Analytics,Services in Data Analytics
Assistance Requested for Data Encryption Issue,Assistance Requested for Data Encryption Issue
Potential Data Breach in Healthcare IT,Potential Data Breach in Healthcare IT
Anfrage zur Behebung eines Verbindungsaufschluss-Fehlers bei der Website-Analytics-Platteform,Request for a connection closure error on the website Analytics platform
Support Request for Encrypted Medical Data Issue,Support Request for Encrypted Medical Data Issue
Advice on Securing Medical Data,Advice on Securing Medical Data
Probleme mit den Datenanalyse-Dashboards,Problems with data analysis boards
Netzwerkverbindung fiel während der Datenanalyse aus,Network connection failed during data analysis
Enhanced Security Protocols for Medical Data,Enhanced Security Protocols for Medical Data
Request for Overview of Scalable SaaS Features for Project Management,Request for Overview of Scalable SaaS Features for Project Management
Pilz auf Medizinische Datensicherheit,Pill on Medical Data Security
Support Request for Data Optimization and Investment Strategies,Support Request for Data Optimization and Investment Strategies
Support Enquiry for Medical Data Breach,Support Enquiry for Medical Data Breach
Inquiry Regarding Necessary System Specifications for Peak Device Functionality,Inquiry Regarding Necessary System Specifications for Peak Device Functionality
Choices for HR Training,Choices for HR Training
Modification Required,Change Required
Recurring Connection Problems with SaaS Application Across Various Devices,Recurring Connection Problems with SaaS Application Across Various Devices
Digital Mark Growth Strategy,Digital Mark Growth Strategy
Support for Investment Optimization and Data Analysis,Support for Investment Optimization and Data Analysis
Verbessern Sie die Benutzeroberfläche für eine erweiterte Projektwerkflows-Visualisierung,Improve the user interface for an extended projectflows visualization
Problem with Data Analytics Dashboard Performance,Problem with Data Analytics Dashboard Performance
Probleme mit den Social-Media-Verfolgungsdaten,Problems with social media tracking data
Update Integration Features,Update Integration Features
Technical Assistance,Technical Assistance
Assistance with Declining Website Traffic,Assistance with Declining Website Traffic
Guide for Integrating Joomla SaaS Project Management Solution,Guide for Integrating Joomla SaaS Project Management Solution
Urgency in Enhancing Encryption for Medical Data Protection,Urgency in Enhancing Encryption for Medical Data Protection
Handbuch,Handbook
Upgrade Medical Data Security Protocols,Update Medical Data Security Protocols
Investment Analysis Platform Data Output Issues,Investment Analysis Platform Data Output Issues
Support for SQL Server,SQL Server Support
Concerns Regarding Engagement Metric Reduction,Concerns Regarding Engagement Metric Reduction
Problem with Data Analytics,Problem with Data Analytics
Assistance with Technical Issue,Assistance with Technical Issue
Assistance with Security Issues,Assistance with Security Issues
Advice for Enhancing,Advice for Enhancing
Problem with Software Updates Today,Problem with Software Updates Today
Concern About Project Schedule,Concern About Project Schedule
Projekt-Timeline-Problematik,Project Timeline Problem
Sicherheitslücke in Krankenhaus-System,Safety accidents in the hospital system
Hilfe bei der MySQL-Integration für SaaS-Projektmanagement-Software,Help with MySQL integration for SaaS project management software
Unintended Loss of Campaign Data Following Node.js Update,Unintended Loss of Campaign Data Following Node.js Update
Investment Prognoseunterschied Problem,Investment Prognosis issue
Technische Problematik,Technical problems
Strategien für Markenwachstum im Digitalland,Market growth strategies in the digital country
Inquiry regarding available digital strategy packages,Inquiry regarding available digital strategy packages
Optimierung von Investitionen mit DataRobot,Optimisation of investments with DataRobot
Strategien für den Markenwachstum,Market growth strategies
Problem with Data Access,Problem with Data Access
Sachverhalt,Case-law
Enquire About Integrating Airtable with Cassandra,Enquire About Integrating Airtable with Cassandra
Problem with Metrics of Digital Campaign,Problem with Metrics of Digital Campaign
Finanzfirma Datensynchronisationsprobleme bei Investitionsanalyse aufgrund Netzwerkunstabilität,Financial firm data synchronization problems in investment analysis due to network instability
Data Analytics Tools Inquiry,Data Analytics Tools Inquiry
Frage zur Digitalisierung von Smart Home Produkten,Question about digitalization of Smart Home products
Notwendige Unterstützung bei Sicherheitsverstoß,Necessary support in the event of security loss
Aid Required for Project,Aid Required for Project
Investment Optimization Services Inquiry Today,Investment Optimization Services Inquiry Today
Request for Enhancing Maintenance Schedule for Better Performance,Request for Enhancing Maintenance Schedule for Better Performance
Hilfe bei der Integration von Microsoft Office 365,Support for the integration of Microsoft Office 365
Technische Anomalie,Technical Anomalies
Healthcare Access Concern,Healthcare Access Concern
Issue Notification,WarningIsue Notification
Guidance on Securing Medical Data with Snagit and KNIME,Guidance on Securing Medical Data with Snagit and KNIME
Enhancing Firm's Investment Portfolio Strategies,Enhancing Firm's Investment Portfolio Strategies
Concern Regarding Data Analytics Tools Performance,Concern Regarding Data Analytics Tools Performance
Technische Anliegen,Technical information
Guidelines for Securing Medical Data in OBS Studio Software,Guidelines for Securing Medical Data in OBS Studio Software
Inquiry on Digital Strategies for Brand Growth,Inquiry on Digital Strategies for Brand Growth
Concern Regarding Data Encryption,Concern Regarding Data Encryption
Urgent Assistance Required for Medical Data Breach Incident,Urgent Assistance Required for Medical Data Breach Incident
Strategies for Digital Brand Growth with SQL Server 2019,Strategies for Digital Brand Growth with SQL Server 2019
Growth,Growth
Problem with Payment,Problem with Payment
Investment Support,Investment Support
Informationen über die Kostenstruktur für die Hemingway-Editor-Integration,Information on the cost structure for Hemingway Editor Integration
Incident of Data Breach in Hospital Systems,Incident of Data Breach in Hospital Systems
Technische Unterstützung,Technical support
Request for Data Analytics Solutions to Optimize Investment Strategies,Request for Data Analytics Solutions to Optimize Investment Strategies
Support from Customer,Support from Customer
Support,Support
Support for Corrupted USB-Stick,Support for Corrupted USB-Stick
Tools für Datenanalyse in QuickBooks Online,Tools for data analysis in QuickBooks Online
Seeking Recommendations for Data Analytics Tools for Investment Optimization,Seeking Recommendations for Data Analytics Tools for Investment Optimization
Support for Docker,Docker Support
Available Digital Strategy Options for Brand Growth,Available Digital Strategy Options for Brand Growth
Enquiry on Integrating Data Analytics Tools with Investment Software,Enquiry on Integrating Data Analytics Tools with Investment Software
Bericht über Absturz des Crash-Issue-Tools,Crash Issue tool crash report
Enhancing Investment Portfolio Optimization,Enhancing Investment Portfolio Optimization
Unvereinbare Kosten für Datenanalyse identifiziert,Inadmissible costs for data analysis identified
Informationen über integrierbare Analysewerkzeuge mit SAP ERP,Information on integrated analytical tools with SAP ERP
Trouble with Project Management Application,Trouble with Project Management Application
Problem with Data Analytics Software Setup,Problem with Data Analytics Software Setup
Problem with Website Loading Speed,Problem with Website Loading Speed
Modify My Profile,Edit My Profile
Problem mit der Docker-Aktualisierung,Problem with docking update
Sudden failure of Discord Moodle integration,Sudden failure of Discord Moodle integration
Inquiry About Scalability Features in Project Management SaaS,Inquiry About Scalability Features in Project Management SaaS
Enhancing Security for Medical Data,Enhancing Security for Medical Data
Request for Robust Encryption Implementation,Enquiry for robust Encryption Implementation
Concerning Performance,Concerning Performance
Support for Smart Tracker Investment Analytics,Support for Smart Tracker Investment Analytics
Enquiry on Tools for Optimizing Investment Portfolios for High Returns,Enquiry on Tools for Optimizing Investment Portfolios for High Returns
Hilfe bei digitalen Wachstumsstrategien erforderlich,Assistance in digital growth strategies is needed
Medical Data Security,Medical Data Security
Problem with Investment Analysis Dashboard,Problem with Investment Analysis Dashboard
Details zu Integrationsoptionen für Microsoft Teams in Projektmanagement-SaaS,Details about integration options for Microsoft teams in project management-SaaS
Ensuring the Security of Medical Data,Ensuring the Security of Medical Data
Problem mit Scanner-Synchronisation,Problem with scanner synchronization
Probleme bei der Zugriffssteuerung auf Arztakte,Problems with access control on medicinal products
Technical Support,Technical Support
Assistance with SaaS Project Management Commands,Assistance with SaaS Project Management Commands
Google Cloud Support,Google Cloud Support
Bericht über Software-Arbeitsstörung,Report on loss of software
Misleading Invoices,Misleading Invoices
Unforeseen Costs on My Subscription Plan This Day,Unforeseen Costs on My Subscription Plan This Day
Request for Data Analytics Support,Request for Data Analytics Support
Boosting Brand Expansion Through Digital Tactics,Boosting Brand Expansion Through Digital Tactics
Support Request for Data Analytics Tools Integration with QuickBooks Online,Support Request for Data Analytics Tools Integration with QuickBooks Online
Support for DataRobot Integration Documentation,Support for DataRobot Integration Documentation
Problem with Data Visualization Feature,Problem with Data Visualization Feature
Enhancing Investment Decisions Through Data Analytics,Enhancing Investment Decisions Through Data Analytics
Problem with Data Processing,Problem with Data Processing
Concerns About Medical Data Security,Concerns About Medical Data Security
Problem with Analytics Dashboard,Problem with Analytics Dashboard
Request for Updating Marketing Campaign,Request for Updating Marketing Campaign
Fehler in der Datenverschlüsselung,Data encryption error
Consent for Data Utilization,Consent for Data Utilization
Langsame Leistung bei Projektmanagement-SaaS,Long-term performance at project management SaaS
Problem with the Home Page of the Website,Problem with the Home Page of the Website
Enquiry on Data Analytics Services for Investment Strategies,Enquiry on Data Analytics Services for Investment Strategies
Versicherung medizinischer Daten in Scrivener Shopware,Medical data insurance in Writeener Shopware
Sicherung medizinischer Daten in Krankenhäusern,Safety of medical data in hospitals
Support Request Submited,Support Request Submitd
Report on Compatibility Issues with ClickUp,Report on Compatibility Issues with ClickUp
Skalierbare Funktionalitäten für Projektmanagement,Scalable features for project management
Sicherheitsmaßnahmen für medizinische Datenlagerungen,Safety measures for medical data storage
Verbessern der digitalen Marketingstrategie bitte,Please improve the digital marketing strategy
Probleme bei der Synchronisation des Scanners mit SAP ERP-System,Problems with the synchronization of the scanner with SAP ERP system
Concerning Systems Security,Concerning Systems Security
Support Needed for Application Crashes,Support Needed for Application Crashes
Reported Medical Data Breach Incident,Reported Medical Data Breach Incident
SAP ERP Central Component 6.0 Integration Inquiry,SAP ERP Central Component 6.0 Integration Inquiry
Issue with Financial Tool Processing Data Analytics,Issue with Financial Tool Processing Data Analytics
Project Dashboard Loading Issue,Project Dashboard Loading Issue
Fehler beim Projekt-Sync heute vollständig misslungen,A project sync error has occurred today
Problem with Data Accuracy in Investment Analytics Dashboard,Problem with Data Accuracy in Investment Analytics Dashboard
Fehlerbericht,Error report
Guide for Integrating SendGrid SaaS,Guide for Integration SendGrid SaaS
Inquiry About Upcoming Features for Project Management SaaS,Inquiry About Upcoming Features for Project Management SaaS
Act Now to Upgrade Data Analytics Tools,Act Now to Upgrade Data Analytics Tools
Protecting Medical Information,Protecting Medical Information
Request for Adjustment of Billing for Marketing Services,Request for Adjustment of Billing for Marketing Services
Azure SQL Pricing Plans Inquiry,Azure SQL Pricing Plans Inquiry . . . . . . . . . . . . . . . . . . . . . . . . . . . . . . . . . . . . . . . . . . . . . . . . . . . . . . . . . . . . . . . . . . . . . . . . . . . . . . . . . . . . . . . . . . . . . . . . . . . . . . . . . . . . . . . . . . . . . . . . . .
QuickBooks Support,QuickBooks Support
Problem Regarding the Launch of Digital Marketing Campaigns,Problem Regarding the Launch of Digital Marketing Campaigns
Medizinische Datenverletzung durch unverschlüsselte Git-Repository-Daten,Medical data loss due to unencrypted Git repository data (Git-repository data) . . . . . . . . . . . . . . . . . . . . . . . . . . . . . . . . . . . . . . . . . . . . . . . . . . . . . . . . . . . . . . . . . . . . . . . . . . . . . . . . . . . . . . . . . . . . . . . . . . . . . . . . . . . . . . . . . . . . . . . . . . . . . . . . . .
Request for Security Measures on Medical Data,Request for Security Measures on Medical Data
Request for Security Support,Request for Security Support
Trouble with Software,Trouble with Software
Improvement in MongoDB 4.4 for Marketing Analytics,Improvement in MongoDB 4.4 for Marketing Analytics
Inquiry on Data Analytics Tools for Drupal Integration,Inquiry on Data Analytics Tools for Drupal Integration
Data Loss Issue,Data Loss Issue
Incident of Software Crashing,Incident of Software Crashing
Request for a Novel Data Visualization Tool,Request for a Novel Data Visualization Tool
Strategies for Brand Growth Have Hit a Standstill,Strategies for Brand Growth Have Hit a Standstill
Digital Support,Digital Support
Unerwartete Gebühren auf Rechnung,Unexpected fees on account
Datenschutz und Verschlüsselungsmethoden benötigt,Data protection and encryption methods are required. . . . . . . . . . . . . . . . . . . . . . . . . . . . . . . . . . . . . . . . . . . . . . . . . . . . . . . . . . . . . . . . . . . . . . . . . . . . . . . . . . . . . . . . . . . . . . . . . . . . . . . . . . . . . . . . . . . . . . . . . . . .
Support for Financial Firms' Analytics Tools,Support for Financial Firms' Analytics Tools
Problem with Medical Scanner - Firmware Outdated,Problem with Medical Scanner - Firmware Outdated
Technical Problem,Technical Problem
Digital Marketing Strategies,Digital Marketing Strategies (MCT) . . . . . . . . . . . . . . . . . . . . . . . . . . . . . . . . . . . . . . . . . . . . . . . . . . . . . . . . . . . . . . . . . . . . . . . . . . . . . . . . . . . . . . . . . . . . . . . . . . . . . . . . . . . . . . . . . . . . . . . . . . . .
Update Marketing Strategies,Update Marketing Strategies
Kundenservice,Customer service: . . . . . . . . . . . . . . . . . . . . . . . . . . . . . . . . . . . . . . . . . . . . . . . . . . . . . . . . . . . . . . . . . . . . . . . . . . . . . . . . . . . . . . . . . . . . . . . . . . . . . . . . . . . . . . . . . . . . . . . . . . . . . .
Medical Data Problem,Medical Data Problem
Problem with Digital Campaign Metrics,Problem with Digital Campaign Metrics
Data Protection,Data Protection
