original,translated
Concerns about Display Configuration,Concerns about Display Configuration
Kosteninformationen für die Integration des Hemingway Editors in unsere SaaS-Plattform,Cost information for the integration of Hemingway Editor into our SaaS platform
Data Breach,Data Breach
Sicherheit von medizinischen Daten mit Docker und GitLab,Safety of medical data with Dock and GitLab
Tech Support,Tech Support
Reported Issue with Server Downtime,Reported Issue with Server Downtime
Support Security,Support Security
Probleme bei der Funktionalität digitaler Kampagnen,Problems in the functionality of digital campaigns
Systemanforderungen für JIRA Software Integration,System requirements for JIRA Software Integration
Urgent Request for Integration Updates,Urgent Request for Integration Updates
Enquiry on Data Security Measures for Hospital Products,Enquiry on Data Security Measures for Hospital Products
Problem with CRM Synchronization,Problem with CRM Synchronization
Digitales Markenwachstum,Digital Marker Growth
Fehler bei CyberLink PowerDirector 19,Error in CyberLink PowerDirector 19
Detailed Information on Scalable Project Management Solutions,Detailed Information on Scalable Project Management Solutions
Request for Technical Support,Request for Technical Support
Revise Digital Marketing Tactics for Enhanced Business Expansion,Revise Digital Marketing Tactics for Enhanced Business Expansion
Ungerechtfertigte Brand-Vermeldung wurde gemeldet,Invalid fire notification received
Inquiry About Customization Options for User Roles and Permissions,Inquiry About Customization Options for User Roles and Permissions
Problem with Login Access,Problem with Login Access
Problem with Microsoft Teams Integration,Problem with Microsoft Teams Integration
Technische Anschlussprobleme,Technical connection problems
Possible Data Compromise,Cannot initialise Evolution's mail component.
Support für Adobe Creative Cloud,Support für Adobe Creative Cloud
Data Encryption Malfunction,Data Encryption Malfunction
Enquiry on Enhancing Data Analytics Tools for Investment Forecasting and Portfolio Management,Enquiry on Enhancing Data Analytics Tools for Investment Forecasting and Portfolio Management
Inquiry on Integration Options for Drupal Commerce with Microsoft Dynamics 365,Inquiry on Integration Options for Drupal Commerce with Microsoft Dynamics 365
Nachricht über den langsamen Ladeprozess des Dashboards,Message about the slow loading process of the Dashboard
Request for Services on Securing Medical Data in Hospital Systems,Request for Services on Securing Medical Data in Hospital Systems
Enhancing Airtable for Marketing Efficiency,Enhancing Airtable for Marketing Efficiency
QuickBooks Online Integration Tools,QuickBooks Online Integration Tools
Unerlaubter Zugriff auf medizinische Datensysteme,Unauthorised access to medical data systems
Enhance Digital Marketing Tools and Strategies,Enhance Digital Marketing Tools and Strategies
Data Leak Incident,Data Lock Incidence
Support for Incident Involving Potential Vulnerabilities in Hospital Infrastructure,Support for Incident Involving Potential Vulnerabilities in Hospital Infrastructure
Probleme mit medizinischen Daten,Medical data problems
Security Measures for Medical Data,Security Measures for Medical Data
Project Timeline Integration,Project Timeline Integration
Problem with Login System,Problem with Login System
Enhancing Investment Tactics Through Data Analytics Solutions,Enhancing Investment Tactics Through Data Analytics Solutions
Inquiry about Digital Strategies for Zoho CRM,Inquiry about Digital Strategies for Zoho CRM
Support for Customers,Support for Customers
Inquiry About Billing Features in JIRA Software,Inquiry About Billing Features in JIRA Software
Concern about Data Security via Unsecured Docker Container,Concern about Data Security via Unsecured Docker Container
System Crashes,System Crashes
Smart Home,Smart Home
Digital Strategies for Android 12 User Growth,Digital Strategies for Android 12 User Growth
Recurring Problem with Accessing the Login Page of the Dashboard,Recurring Problem with Accessing the Login Page of the Dashboard
Report on Service Interruptions,Report on Service Interruptions
Exploring Digital Strategies for Brand Growth,Exploring Digital Strategies for Brand Growth
Network Issues Concern,Network Issues Concern
Mehrere Integrationen stellen Probleme dar,Multiple integration problems
Information on Digital Brand Growth Strategies,Information on Digital Brand Growth Strategies
Crash,Crash
Concern Regarding Digital Campaigns,Concern Regarding Digital Campaigns
Support for the SaaS Project Management Platform,Support for the SaaS Project Management Platform
Support Request for Temporary User Authentication Issues During Peak Times,Support Request for Temporary User Authentication Issues During Peak Times
Issue Regarding Login Duration Today,Issue Regarding Login Duration Today
Support for Data Analytics,Support for Data Analytics
Support for Repeated Crashes in ClickUp-Integration,Support for Repeated Crashes in ClickUp-Integration
Login Issues Recently Reported,Login Issues Recently Reported
IT-Issue,IT-Issue
Support needed,Support needed
Problem with Investment Reports,Problem with Investment Reports
Strategies for Brand Expansion Using AWS and WordPress,Strategies for Brand Expansion Using AWS and WordPress
Unerwarteter Verschlüsselungsfehler aufgetreten,Unexpected encryption error
Support Needed for Unauthorized Access Incident,Support Needed for Unauthorized Access Incident
Ungenauen Investitionsprognosen melden,Report Unfailing Investment Forecasts
Probleme mit der WLAN-Verbindung,Problems with the Wi-Fi connection
Request for Customer Support,Request for Customer Support
Irregular Data Reporting in Dynamics,Irregular Data Reporting in Dynamics
Issue with Monthly Invoice Charges,Issue with Monthly Invoice Charges
Digital Campaign Performance Below Expected Standards,Digital Campaign Performance Below Expected Standards
Digital Campaigns Have Come to a Halt Because of Potential Integration Problems,Digital Campaigns Have Come to a Halt Because of Potential Integration Problems
Transmission of Pricing Framework for Digital Marketing Services,Transmission of Pricing Framework for Digital Marketing Services
Technische Störung,Technical Disorder
Request for Data Update,Request for Data Update
Service Outage,Service Outage
Social Media,Social Media
Request for Enhanced Integration with Salesforce CRM Data Analytics Tools,Request for Enhanced Integration with Salesforce CRM Data Analytics Tools
Inquiry About Digital Strategy Services for Brand Growth,Inquiry About Digital Strategy Services for Brand Growth
Request for Assistance with Potential Data Breach,Request for Assistance with Potential Data Breach
Request for Pricing of Zoho Books Integration,Request for Pricing of Zoho Books Integration
Expanding Reach Through Digital Strategies,Expanding Reach Through Digital Strategies
Inquiry about Acceptable Payment Methods,Inquiry about Acceptable Payment Methods
Investment Data Analytics Pipeline,Investment Data Analytics Pipeline
Unterstützung für Projektmanagement SaaS,Support for SaaS project management
Investment-Prognosen funktionieren plötzlich nicht mehr,Investment projections do not work immediately anymore
Support Request for Smartsheet Integration,Support Request for Smartsheet Integration
Problem with Data Synchronization,Problem with Data Synchronization
Issues with Data Analytics Tool,Issues with Data Analytics Tool
Fehler mit digitalen Kampagnen,Digital Campaigns Error
Traffic Support Inquiry,Traffic Support Inquiry
Issue with website crash during digital campaign launch today,Issue with website crash during digital campaign launch today
Frage zur Datenverschlüsselung von Patientendaten auf Apple MacBook Air in Krankenhaus,Question about data encryption of patients' data on Apple MacBook Air in Hospital
Aid regarding technical issues,Aid regarding technical issues
Issues with Digital Brand Management,Issues with Digital Brand Management
Die Data Analytics-Plattform brach über Nacht zusammen,The data Analytics platform brought together by night
Digitale Strategien für Geschäftswachstum,Digital strategies for business growth
Report on Encryption Malfunction,Report on Encryption Malfunction
Medizinische Datenschutzfunktionen,Medical data protection functions
Services for Brand Growth,Services for Brand Growth
Support Security Incident,Support Security Incident
Optimierung von Investitionen durch Nutzung von Datenanalytik-Tools,Optimisation of investments using dataanalytic tools
Sicherheitswarnung,Security Warning
Enquete über Zahlungsmöglichkeiten für Software-Abonnements und Hardware,Enquiries about payment options for software subscriptions and hardware
"Verbesserung der Leistung und Skalierbarkeit des SaaS-Project-Management-Systems, inklusive Update","Improve performance and scaleability of the SaaS project management system, including updates"
Concern Regarding Data Breach,Concern Regarding Data Breach
Issue with Project Management,Issue with Project Management
Versagte Integrationsverbindungen und API-Kompatibilität,Forgotten integration connections and API compatibility
Issue with SaaS-Platform,Issue with SaaS-Platform
Sicherung medizinischer Daten bei Gesundheitsversorger,Safety of medical data in the case of healthcare providers
Medizinische Datenschutzmaßnahmen Verbesserung,Improving medical data protection measures
Problem,Problem
Verbesserung der Investment-Analyse für Microsoft Azure-Lösungen,Improving investment analysis for Microsoft Azure solutions
Optimization of Investment Portfolios Using Data Analytics,Optimization of Investment Portfolios Using Data Analytics
Optimal Elasticsearch 7.13 Setup for Investment Forecasting,Optimal Elasticsearch 7.13 Setup for Investment Forecasting
Request for Detailed Billing Information for Digitalkamera ESET NOD32 Antivirus 14,Request for Detailed Billing Information for Digitalkamera ESET NOD32 Antivirus 14
Microsoft Teams Support,Microsoft Teams Support
Hinweis über plötzlich verschwindende Projektdaten,Quick-dry project data information indication: @title: column Name of the project. . . . . . . . . . . . . . . . . . . . . . . . . . . . . . . . . . . . . . . . . . . . . . . . . . . . . . . . . . . . . . . . . . . . . . . . . . . . . . . . . . . . . . . . . . . . . . . . . . . . . . . . . . . . . . . . . . . . . . . . . . . . . . . . . . . . . . . .
Inquiry on Securing Medical Data in SAP ERP Central Component 6.0,Inquiry on Securing Medical Data in SAP ERP Central Component 6.0
Hilfe bei der Optimierung der Datenanalyse für Anlageentscheidungen,Help in optimising the data analysis for plant decisions
Issues with Data Analysis Service,Issues with Data Analysis Service
Support for Project Management Integration,Support for Project Management Integration
Connectivity Challenges in Project Management SaaS,Connectivity Challenges in Project Management SaaS
Detected Unauthorised Access to Medical Data,Detected Unauthorised Access to Medical Data
Error During Data-Synchronization Across Various Platforms,Error During Data-Synchronization Across Various Platforms
Problem with Software Crashes and Errors,Problem with Software Crashes and Errors
Assistance,Assistance
Enhancing Investments with DataRobot's Advanced Analytics,Enhancing Investments with DataRobot's Advanced Analytics
Enhancing Investment Analytics Support with MATLAB,Enhancing Investment Analytics Support with MATLAB
Exploring SaaS Features for Project Management and Scalability,Exploring SaaS Features for Project Management and Scalability
Boost User Experience,Boost User Experience
Billing Issue,Billing Issue
Concerns About Hospital Security Systems,Concerns About Hospital Security Systems
Problem with Data Analytics Dashboard Efficiency,Problem with Data Analytics Dashboard Efficiency
Alert on Security Incident,Alert on Security Incident
Problems with Digital Tools,Problems with Digital Tools
Issue with Campaign Analytics Dashboard,Issue with Campaign Analytics Dashboard
Request for Details on Project Management SaaS Features,Request for Details on Project Management SaaS Features
Issue Reported with Investments Optimization Tool Loading,Issue Reported with Investments Optimization Tool Loading
Login Problem,Login Problem
Support for Alteryx,Support for Alteryx
Smart Home Systems,Smart Home Systems
Concern About Data Security,Concern About Data Security
Identified Problems with Airtable Synchronization,Identified Problems with Airtable Synchronization
Neuauflage von Rechnungsunterschieden nach Tarifänderungen,New ceiling of account differences after tariff changes
Enquiry Regarding Payment Options,Enquiry Regarding Payment Options
Encountering Problems with Data Analytics Tool,Encountering Problems with Data Analytics Tool
Support for Smartsheet Elasticsearch Integration,Support for Smartsheet Elasticsearch Integration
Exploring Digital Strategies for Brand Growth Online,Exploring Digital Strategies for Brand Growth Online
Enhancing Investment Strategies with KNIME,Enhancing Investment Strategies with KNIME
Team Collaboration Issues,Team Collaboration Issues
Unangemessene Unterbrechung gemeldet,Inappropriate interruption reported
Issues with Delayed Response Times Noted Lately,Issues with Delayed Response Times Noted Lately
Unexpected System Outage Reported,Unexpected System Outage Reported
JIRA Assistance,JIRA Assistance
Problem with Project Synchronization,Problem with Project Synchronization
Unanticipated Fees in My Bill,Unanticipated Fees in My Bill
Problem with Docker Update,Problem with Docker Update
Improve Data Analytics Tools,Improve Data Analytics Tools
Report on Unapproved Access: Hospital Systems Affected,Report on Unapproved Access: Hospital Systems Affected
Concerning Security Breach in Hospital IT System,Concerning Security Breach in Hospital IT System
Request for Information on Integrating Smartsheet Scalable SaaS Project Management,Request for Information on Integrating Smartsheet Scalable SaaS Project Management
Strategies for Brand Growth in Digital Marketing,Strategies for Brand Growth in Digital Marketing
Problems with Data Connection Interruption,Problems with Data Connection Interruption
Problem with investment figures not refreshing properly,Problem with investment figures not refreshing properly
Security Concern: Unauthorized Access to Medical Data,Security Concern: Unauthorized Access to Medical Data
Problem with Data Analytics Dashboard,Problem with Data Analytics Dashboard
Probleme mit der Systemleistung,System performance problems
Problem with project data integrity,Problem with project data integrity
Medizinische Datensicherheit,Medical data security
Request from Customer Service,Request from Customer Service
Improving Brand Expansion Through Digital Tactics,Improving Brand Expansion Through Digital Tactics
Support Inquiry Regarding Data Analytics Capabilities with DataRobot,Support Inquiry Regarding Data Analytics Capabilities with DataRobot
Informationen zu digitalen Strategie-Dienstleistungen bei der Markengründung,Information on digital strategic services in the creation of the market
Update des Zahlungssystems,Up-to-date of the payment system
Detected Unauthorized Access in Medical Records System,Detected Unauthorized Access in Medical Records System
Request for Information on Digital Strategy Services to Boost Brand Growth,Request for Information on Digital Strategy Services to Boost Brand Growth
Technische Schwierigkeit,Technical difficulty
Anfrage zur Unterstützung,Request for support
Digital campaign halted,Digitally held campaign
Verbesserung des Anlageportfolios,Improving investment portfolios
Integration Options for Ableton Live 11 Suite,Integration Options for Ableton Live 11 Suite
Billing Concern,Billing Concern
Required Assistance with Marketing,Required Assistance with Marketing
Problem with Server Response Time During Peak Hours,Problem with Server Response Time During Peak Hours
Probleme bei der Verschlüsselung medizinischer Daten,Problems in the encryption of medical data
Inquiry on Payment Methods for RAID-Controller and Hub Services,Inquiry on Payment Methods for RAID-Controller and Hub Services
Problem with Integration Utilities,Problem with Integration Utilities
Bestätigung autorisierten Zugriffs auf das Krankenhaus-IT-System,Confirmation of authorised access to the hospital IT system
Concerns Regarding the Performance of the Investment Algorithm,Concerns Regarding the Performance of the Investment Algorithm
Tastatur-Fehler bei einer Präsentation,Keyboard Error in Presentation
Assistance with Digital Strategies,Assistance with Digital Strategies
Security Features for Medical Data,Security Features for Medical Data
Improved Security for Medical Data,Improved Security for Medical Data
Technische Unterstützung Anfrage,Technical support request
Kombination von Analytics-Tools mit KNIME zur Steigerung der Investitionsoptimierung,Combination of Analytics tools with KNIME to increase investment optimization
Sicherheitsprotokolle für die Datensicherheit medizinischer Daten in Krankenhäusern,Safety protocol for the data safety of medical data in hospitals
Security Protocols for Medical Data Integrity and Confidentiality,Security Protocols for Medical Data Integrity and Confidentiality
Performance Concerns,Performance Concerns
Kundendienst,Customer Service
Strategies for Expanding with HubSpot,Strategies for Expanding with HubSpot
Ecommerce Support,ECommerce Support
Denied Access to Medical Information,Denied Access to Medical Information
Router Problem,Router Problem
System Specifications for Project Management Tool,System Specifications for Project Management Tool
Salesforce Data Analytics Inquiry,Salesforce Data Analytics Inquiry
Reported Malfunction of Data Analytics Software,Reported Malfunction of Data Analytics Software
Investment-Models are malfunctioning,Investment models are malfunctioning
Hilfe bei Datenverstoß erforderlich,Help in data loss is required
Problem with Dashboard,Problem with Dashboard
Problem with Medical Scanner Operation,Problem with Medical Scanner Operation
Probleme mit IntelliJ IDEA,"Problems with IntelliJ IDEA, . . . . . . . . . . . . . . . . . . . . . . . . . . . . . . . . . . . . . . . . . . . . . . . . . . . . . . . . . . . . . . . . . . . . . . . . . . . . . . . . . . . . . . . . . . . . . . . . . . . . . . . . . . . . . . . . . . . . . . . . . . . ."
Encryption for Medical Data Storage,Encryption for Medical Data Storage
KNIME Investment Analytics Solutions,KNIME Investment Analytics Solutions
Störungen beim Projekt-Deskriptor,Project descriptor interrupts
Optimierungsmethoden für Anlageanalyse,Optimisation methods for plant analysis
Problem mit dem Starten des Software,Problem Starting Software
Request for Security Measures for MongoDB 4.4 in a Hospital Setting,Request for Security Measures for MongoDB 4.4 in a Hospital Setting
Update sales collateral with latest features,Update sales collateral with latest features
Unexpected Stalling of Digital Campaigns Due to Potential Configuration Issues,Unexpected Stalling of Digital Campaigns Due to Potential Configuration Issues
Optimization of Investment Portfolios Using Data Analytics Tools,Optimization of Investment Portfolios Using Data Analytics Tools
Problem with Excel Analysis Tool,Problem with Excel Analysis Tool
Problem with Data Breach,Problem with Data Breach
Problem während der Kampagnenstart am heutigen Tag,Problem at the start of the campaign today
Probleme mit dem NAS-System,Problems with the NAS system
Optimizing Data Analytics Tools,Optimizing Data Analytics Tools
Sicherheitsanomalie,Security threshold
Hospital Systems Security Incident,Hospital Systems Security Incident
"Kann ich Anleitungen zur Sicherung medizinischer Daten in einem PostgreSQL-Umfeld für Krankenhäuser erhalten? Es ist wichtig, dass Patientenakten geschützt sind.",Can I get guidance on the protection of medical data in a PostgreSQL field for hospitals? It is important that patient acts are protected. . . . . . . . . . . . . . . . . . . . . . . . . . . . . . . . . . . . . . . . . . . . . . . . . . . . . . . . . . . . . . . . . . . . . . . . . . . . . . . . . . . . . . . . . . . . . . . . . . . . . . . . . . . . . . . . . . . . . . . . . . . . . . . . . . .
Unexpected Denial of Medical Data Access Post-Update,Unexpected Denial of Medical Data Access Post-Update
Inquiry about Digital Strategies for Brand Growth,Inquiry about Digital Strategies for Brand Growth
Erlangung von medizinischen Informationen,Acquisition of medical information
Können weitere Details zu digitalen Marketingstrategien bereitstellen?,Can further details be provided on digital marketing strategies? . . . . . . . . . . . . . . . . . . . . . . . . . . . . . . . . . . . . . . . . . . . . . . . . . . . . . . . . . . . . . . . . . . . . . . . . . . . . . . . . . . . . . . . . . . . . . . . . . . . . . . . . . . . . . . . . . . . . . . . . . .
Inquiry on Digital Strategies for Brand Growth with Pro Tools and Docker,Inquiry on Digital Strategies for Brand Growth with Pro Tools and Docker
Welche Analyse-Tools sind mit Xero und Shopify vereinbar zur Verbesserung der Investitionen?,What analysis tools are compatible with Xero and Shopify to improve investment? . . . . . . . . . . . . . . . . . . . . . . . . . . . . . . . . . . . . . . . . . . . . . . . . . . . . . . . . . . . . . . . . . . . . . . . . . . . . . . . . . . . . . . . . . . . . . . . . . . . . . . . . . . . . . . . . . . . . . . . . . . . . .
Project Management Services,Project Management Services
Cassandra Crash Issue,Cassandra Crash Issue
Sicherheitsmaßnahmen für medizinische Daten,Safety measures for medical data
Data Security,Data Security
Needs Attention for Inaccurate Investment Projections,Needs Attention for Inaccurate Investment Projections
Guidance on Integrating Subversion SaaS Solution,Guidance on Integrating Subversion SaaS Solution
Error,Error
Problem with Data Retrieval,Problem with Data Retrieval
Problem with data analytics platform causing a crash,Problem with data analytics platform causing a crash
Concern About Data Breach in Medical Records Docker Storage,Concern About Data Breach in Medical Records Docker Storage
Incident Report,Incidence Report
Degradierter Schutz patientenbezogener Daten in den letzten Monaten,Degraded protection of patient data in recent months
Support for Multilingual WordPress Setup Required,Support for Multilingual WordPress Setup Required
Probleme bei der Zugriffsverwaltung auf medizinische Daten,Problems in access management to medical data
Problem with Billing Discrepancy on Invoice,Problem with Billing Discrepancy on Invoice
Security Support,Security Support
Forschung zur Wachstumsförderung durch digitale Strategien,Research on the promotion of growth through digital strategies
Investment Projections Mismatch Inquiry,Investment Projections Mismatch Inquiry
Support for Data Breach,Support for Data Breach
SSD Data Synchronization Problem,SSD Data Synchronization Problem
Unterstützung für Integration von Notion und DataRobot,Support for integration of Notion and DataRobot
Boost Digital Strategy Tools for Enhanced Brand Growth,Boost Digital Strategy Tools for Enhanced Brand Growth
Unexpected Failure in Data Encryption Process Today,Unexpected Failure in Data Encryption Process Today
Enhancing Investment Portfolio Management Through Data Analytics,Enhancing Investment Portfolio Management Through Data Analytics
Enhancing Digital Strategies Today,Enhancing Digital Strategies Today
Request for ClickUp Subscription Details,Request for ClickUp Subscription Details
Report on Data Encryption Malfunction,Report on Data Encryption Malfunction
Login Problem Inquiry to Support Team,Login Problem Inquiry to Support Team
Customer Support Smart Products Inquiry,Customer Support Smart Products Inquiry
Unterstützung für Mini-Beamer-Integration,Mini Beamer integration support
Guidance on Securing Medical Data in Oracle Database 19c,Guidance on Securing Medical Data in Oracle Database 19c
Revise Digital Marketing Techniques,Revise Digital Marketing Techniques
Issues with Synchronization between Smartsheet and JIRA,Issues with Synchronization between Smartsheet and JIRA
Optimization of Data Analytics with SAP ERP and MATLAB,Optimization of Data Analytics with SAP ERP and MATLAB
Problem with Investment Analytics Dashboard,Problem with Investment Analytics Dashboard
Incident of Data Leakage in Medical Records System,Incident of Data Leakage in Medical Records System
Support for Data Analytics Tools,Support for Data Analytics Tools
Anfrage zum Fehler im Medien-Daten-Verschlüsselungsprozess,Request for an error in the media data encryption process
Enhancement of Data Analytics with SAP ERP and MATLAB,Enhancement of Data Analytics with SAP ERP and MATLAB
Problem with Project Management Platform,Problem with Project Management Platform
Request for Network Support,Request for Network Support
Request for Documentation on Integrating Adobe Sign,Request for Documentation on Integrating Adobe Sign
Integrate AWS Monday,Integrate AWS Monday
Challenge with Campaign Engagement,Challenge with Campaign Engagement
Request for Enhancement in PostgreSQL Database Support,Request for Enhancement in PostgreSQL Database Support
Request to Update Billing Details for Digital Strategy Tools and Services,Request to Update Billing Details for Digital Strategy Tools and Services
Optimization of Investments Through Data Analytics,Optimization of Investments Through Data Analytics
Assistance from Customer Support,Assistance from Customer Support
Technical Support Inquiry,Technical Support Inquiry
Probleme mit dem Traffic von Websites sinken,Reduce problems with traffic of websites
Support Request for SendGrid AWS,Support Request for SendGrid AWS
